ID,Movie_ID,User_Name,Rating,Title,Content,,,,,,,,,,,,,,,
1,1,TheTopDawg,8,Better than expected!,"For a B-grade film, this was surprisingly better than I expected. The acting was great by all cast members, the directing was on point, the writing was actually pretty good - without many plot issues one would normally expect, the cinematography perfect, the pacing was great, especially for the 107 min length, and the editing not too bad except for the flashbacks. My only critique was the terrible score, especially towards the last act. Had the score been more professional and consistent through out, the suspense would have been stellar instead of adequate. Overall an impressive film. A well deserved 8/10 from me.",,,,,,,,,,,,,,,
2,1,krice23,8,Sold!,"Original script. Believable cast. They make it work easily & all in all it looks like what a thriller should look like! For once Im not grumbling in disappointment over lack of continuity or missed opportunities.Several layers thick with multidimensional characters that behave unexpectantly individual and unique instead of plotted. A pleasant surprise, indeed.Perhaps I should have rated it a 9!?",,,,,,,,,,,,,,,
3,1,celestinoavilajr,8,Entertaining!,Good movie! Great plot! Edge of your seat twist and turns! Picture and acting qualities are excellent!.... If theirs anyone looking for good reviews and not sure of watching. Pay no mind to the bad reviews. If you like crime thrillers.. this is a good one!,,,,,,,,,,,,,,,
4,1,dave-mcclain,8,an expectedly good thriller,"Bad Samaritan"" R"," 151 is a thriller directed by actor-turned-producer Dean Devlin ""Geostorm"""," written by Brandon Boyce ""Wicker Park"" and starring television actor and erstwhile Dr. Who David Tennant. Theres a bit of horror in here too", but this film is primarily an intricately plotted thrill ride.The title character is named Sean Falco Irish actor Robert Sheehan, a young man whose step-father brought him and his mother to the U.S. because of a job opportunity for which Sean resents him. Sean is an aspiring photographer with a beautiful and intelligent college girlfriend named Riley Jacqueline Byers who knows nothing of Seans real passion - stealing. Sean and his best friend, Derek Carlito Olivero work as valets at an expensive Italian restaurant... which is where they choose their marks. As one of them mans the valet stand, the other uses the vehicles, GPS devices and garage door openers of their unsuspecting customers to rob the patrons homes," while theyre just trying to have a nice """,,,,,,,
5,1,neener3707,7,"Done Before, But Not Too Bad, A Little Extra ","Over all not too shabby, definitely better than I expected. So yes its been done many times before, person or in this case; people break in to someones house for some ulterior motive, only to discover the home owner is either hiding something or is some sort of killer. But it throws a little extra into the formula, some works, the emphasis on the killer and his story was refreshing. But is it scary? Is it a horror movie? Because lately so called horror"" movies are indeed not scary at all. And as far as this film is concerned", Im not sure what I want to say, because some of it was effective, and some of it wasnt. First of all, I like how they expanded on the typical story line they were telling, and without giving to much away, it creates this admittedly tense cat and mouse chaotic situation for all parties involved," so I liked how it just didnt stick 100% to the ""Rear Window"" and ""Disturbia"" formulas.But was it scary? Id say it was in places and was not in some"," it was as simple as th""",,,,,,,
6,1,claudio_carvalho,8,Surprisingly Great Thriller,"In Portland, the amateurish photographer Sean Falco Robert Sheehan works with his best friend Derek Sandoval Kerry Condon as valet at a fancy restaurant. His girlfriend Riley Seabrook Jacqueline Byers studies in a university and he is estranged of his stepfather. Sean and Derek are also smalltime burglars, stealing the houses of the costumers while they are eating in the restaurant. One day, the obnoxious client Cale Erendreich David Tennant arrives at the restaurant driving a Maserati and Sean drives his car back to his house using the computer and Derek watches Cale in the restaurant. While snooping around the house, Sean finds a locked room and when he opens the door, he stumbles upon a woman tied to a chair with chains and gagged. He unsuccessfully tries to release her but he is forced to return to the restaurant with the Maserati. Sean decides to call the police, but Cale lures the police officers and turns Sean´s life upside-down. Bad Samaritan"" is a surprisingly great thriller""",,,,,,,,,,,,,,,
7,1,george.schmidt,7,Decent suspense thriller with one box of craz,"BAD SAMARITAN 2018 1/2 David Tennant, Robert Sheehan, Jacqueline Byers, Lisa Brenner, Carlito Olivero, Kerry Condon, Rob Nagle, Hannah Barefoot. Decent suspense thriller with Sheehans petty thief stumbling upon a victim-to-be of a serial killer when he attempts to rob the home and winds up in the crosshairs of an ultimate grudge match/cat-and-mouse with a few good jolts delivered and one box of crazy turn Tennant as the seriously fd up creepazoid. Director Dean Devlin and Brandon Boyces clever script combine for enough popcorn pleasing moments of meta-scream-at-the-screen scenes and even a few canny self-asides to aforementioned sequences.",,,,,,,,,,,,,,,
8,1,patrickc-76383,7,Impressive!,"This movie takes you on an rollercoaster-like adventure that is suspenseful while also favorably is unpredictable. That being said, another thing this movie does well with is its realism. Each scene you see feels natural and true to life. In addition, this movie doesnt cut any corners in the storytelling; there arent any holes in the plot that you wonder about later while watching the movie.In conclusion, this is a very well executed thriller and I would honestly recommend this movie!",,,,,,,,,,,,,,,
9,1,Stars-and-popcorn,6,Bad Samaritan Plays it too Safe,"Bad Samaritan is a movie that Ive been looking forward to for a few months. Ever since David Tennant gave his incredible performance as Kilgrave on the Marvel Netflix series Jessica Jones. The idea of him playing a totally demented psychopath had me giddy with anticipation. However, when it comes to this film thats about where the fun ends. Even with David Tennant playing the big bad wolf, he stumbles too much to save Bad Samaritan from being, well, a bad movie.I really wanted to like Bad Samaritan, especially because Im a sucker for a good horror movie that can make your skin crawl. There are definitely some moments in the film that will make audiences jump and cringe. However, a lot of those scenes that make you cringe are the ones where David Tennants American accent starts to slip. Im not sure why they decided to make his character American, possibly to make Robert Sheehans Irish accent stand out more, but its definitely not one of Tennants strong suits. There are plenty of other t",,,,,,,,,,,,,,,
10,1,pinemaples,8,An unexpected thrill.,"I didnt expect much of a movie with a name like Bad Samaritan, I didnt expect to find something to enjoy about it besides David Tennant playing the villain, and I certainly didnt expect to find a great movie. The only real complaint I have is that the bad guys backstory was dumb, and honestly would have been better off unexplained. I havent seen a movie this consistently intense since The Infiltrator came out two years ago. I was especially impressed with the continuity and attention to detail, and MY GOSH can David Tennant pull off a fantastic American accent.",,,,,,,,,,,,,,,
11,1,rgkarim,7,A Samaritan to the Crime Drama Formula,"With the success of the Avengers last weekend, it is hard for other movies to try and take follow such an impressive record. Still, another week comes with movies that are going to try and fight for their place in the silver screen. My first movie of the week is the latest Horror/Thriller to try and keep you on edge. Robbie K here with another round of writing to help you guys with your movie choices. Sit back and read on as I review Movie Bad Samaritan Director Dean DevlinWriter Brandon Boyce screenplay Stars Kerry Condon, David Tennant, Robert Sheehan LIKESDecent Pacing If youve read my work, you know I like movies that movie, which Bad Samaritan does. Ill admit it takes a while to lift off in an attempt to set the stage, but as the robbery goes bad and the thrills start, things start to pick up. From then on, it seems to move, only hitting rough patches of diverging slowness for small amounts before looping back to the story. Acting Another plus here, the cast has quite an art to he",,,,,,,,,,,,,,,
12,1,vhinzajhltb,9,Had to sign up to make a Rating and Review!,"This movie was unexpectedly amazed me. It just completes my day. Im watching like you cant get off the screen not to miss any scenes cuz you dont know what will happens next. This was been one of the best thriller movie I have seen realizing how good the camera and background sounds was all set up in accordingly. Also plus points for the casts they really gave justice to their own role. One thing Im lacking in this movie is how it ends that Ive just thought it will show the FBI finding out all the burried dead bodies at the backyard then it will be aired on the news and soon Seans gf and his family will finally understand what he had gone through in his situation, thats it.Thumbs up and hi5 for the director and producers of this movie. Hoping for more upcoming movie genre like this.",,,,,,,,,,,,,,,
13,1,natcalgary,7,A pleasant surprise,"I didnt expect much from this but I was deff, impressed. The acting was very good, and the plot well thought out. There were a few parts that were a bit unbelievable, but for the most part it actually seemed like something that could happen for real which made it that much more chilling.7.3",,,,,,,,,,,,,,,
14,1,ThomasDrufke,7,Great B-Movie,"Bad Samaritan is a film that I simply did not know was even being released until I looked on Fandango and checked what movies I could go see yesterday. And besides David Tennant, theres really no big name here at all and there wasnt a single bit of marketing that I saw, so theres that. Really, Bad Samaritan will likely be a film that comes and goes and never knows that it existed. However, I actually thought it was a pretty well made film. Granted, it starts to fall apart after the hour mark, but if youre just looking for a cheap thrill with some fun performances, creepy imagery, and good time at the theater, then look no further than Bad Samaritan. The film has no place making some of the third act decisions it does however, it never fully jumps the proverbial shark, and its always entertaining. 7.3/10",,,,,,,,,,,,,,,
15,1,bdwyphil,10,WOW!,"As my wife abhors any form of violence, I normally dont see films like Bad Samaritan. Its been a long time since Ive been scared in a movie. This film certainly gave me the chills and made my hair stand on end. If youre looking for some thrills with the addition of a moral dilemma, this should be right up your own dark alley.",,,,,,,,,,,,,,,
16,1,terry_z,10,LOVED this movie!!!,"Production was outstanding, story was outstanding, acting was outstanding. There was nothing to dislike. The suspense was palpable throughout. Phenomenal film!!!",,,,,,,,,,,,,,,
17,1,IntoAvoid,4,Hoping for a sleeper thriller? Abandon it.,"Two young men hit upon the idea of using their valet jobs to rob homes. When the owners go in, one valet drives to their house using information stored on the vehicle to lead them straight to the next target. The more reluctant of the two decides to take one such patsys Maserati after the owner rags on both hoodlums with a boorish attitude. Inside the house, a woman is found tied-up, not in a kinky way. Also a roomful of cutlery is discovered.As the dinner was cut short, the car is returned before the woman can be rescued by our good-hearted thief. A phone call is made to the Police, but Mr. Evil is one step ahead, and the home isnt even searched.The lad fesses up to his crime of trespassing to get the Police more involved in a house search; again nothing awry and the kids dismissed with a warning. But not before a suspicious L.E.O. begins to wonder about missing women and this coincidental story of home break-ins.So goes Bad Samaritan"" a tale of a trust fund man who gets his jollies """,,,,,,,,,,,,,,,
18,1,cmharelson-62160,6,An enjoyable and competently performed suspen,"For the most part, this film was well shot, very well acted, and well paced. My only real criticism for the film is the elements I felt were a bit over the top. These would include a bizarrely done flashback snippet, some odd plot occurrences, and a score that I felt elevated the cartoonish nature of the film. Still, would recommend a watch for those who like cat and mouse thrillers.",,,,,,,,,,,,,,,
19,1,stevendbeard,7,Nice little Thriller,"I saw Bad Samaritan""", starring David Tennant-Jessica Jones_tv, Doctor Who_tv; Robert Sheehan-Geostorm, The Mortal InstrumentsCity of Bones; Carlito Olivero-East Los High_tv, Blood Heist and Kerry Condon-Three Billboards Outside Ebbing Missouri, Better Call Saul_tv.This is a nice little thriller about a psycho serial killer. Robert and Carlito are two guys that work as valet parking attendants that are not on the up & up. They park your car and then steal anything they can find. Sometimes, they grab stuff left in the car and sometimes they go to the owners house and burglarize it-hey, they are eating and will be gone for an hour or so. Up comes David. Driving a fancy car and just being rather snotty to the guys. Robert decides to check out Davids house and finds, among other things, Kerry, chained to a chair, with a gag in her mouth and signs of being beaten and tortured. What to do, what to do. Robert tries to set her loose but it is chains bolted to the floor. If he calls the police,"
20,1,spilledinkcinema,7,Great Acting"," So-So Story""","Im a fan of David Tennant, so I cant complain, even if it seems hes a bit typecasted for the bad guy lately. This was all around solid acting film with some dumb choices and a little too convenient plot twists."
21,1,godsgirlfrombluford,9,Edge of your seat romp that keeps the viewer ,"Bad Samaritan is an edge of your seat romp that keeps the viewer guessing what will happen next.Sean Falco Robert Sheehan is a part-time photographer and the burglar who finds a woman being held captive in the home of Cale Erendreich David Tennant. Sean has a moral compass that guides his thievery and does not steal from good people"". Cale is a sociopath", lacking any conscience for the things he does wrong. Katie Kerry Condon is the tortured victim, taken and kept against her will.I felt for Seans plight, trying to save Katie. His desperation on-screen to bring Cale to justice and help Katie was palpable. I wanted to see him those he went to help him make all of this possible. I liked how his character was willing to do whatever it took to do what was necessary.Katie was a completely believable character. From the moment I met her, I wanted to jump through the screen and help her. She was nice and sweet," assisting Sean in any way she could. I hated seeing her treated as she was.Cale w""",,,,,,,,,,
22,1,Platypuschow,7,Bad Samaritan Not half bad,"David Tennant stars as the movies antagonist in a clever little thriller that deserves more recognition than it appears to have recieved.It tells the story of two friends who through their valet job proceed to rob people while they are at the restaurant. But on this occasion one of them finds a little more than he expected as the home contains a chained up woman.Now Bad Samaritan immediatly suffers from a flaw that a lot of movies have have lately. Namely protagonists that I cant care for. Why am I supposed to root for criminals? These people are robbing folks, why am I supposed to care about them? Sadly this has been a big thing lately and really badly needs to stop.The story is great, David Tennant is excellent As always and it all plays out really well. But our lead being a thief just kept nagging at me and bothered me considerably more than it perhaps should.Putting that aside I can confidently say Bad Samaritan is a smart little film, well constructed and well performed so if the ",,,,,,,,,,,,,,,
23,1,mind_killaz-256-895248,8,Pretty good - worth a watch,"It started off just a little slow, but escalated quickly and went non-stop from there. Not the very best, but I really have no complaints. Good story, good action. Pretty good acting! Not the very best, but much better than a lot of movies youve never heard of.",,,,,,,,,,,,,,,
24,1,Neymar,9,"Bad Samaritan, somebody bad, doing a good her","Bad Samaritan is a very interesting title. How can a samaritan be bad? Well this show says it all.2 Thieves stumbled upon a very rich psychopaths home and found out dark chilling secrets about this psychopath. 1 of the thieves did what a samaritan should do, going all out to save the live he felt he had to save, putting his own life into danger.The show first set in a very beautiful typical European scene Scotland i think?, kinda puts you into the life of the main actor. A poor artist, having a pretty girlfriend, and doing sideline"". Working as a ""valet"" at night with his best buddy. The pace of the show was good"," showing at least 1 failed attempt of their ""sideline""", before the encounteringthe psychopath. No rush of pace at all.It also slowly puts the show into mystery and suspense, as they move into the psychopaths life. Audience will start to wonder, what kind of pscyhopath he is, how strong would he be, etc. What i like about this psychopath is," unlike some other psychopaths show """,,,,,,,,
25,1,maruugaa,9,I enjoyed this,"Ill be honest, I had never heard of this movie. I went to the movies for the sake of going to the movies and Isle of Dogs wasnt playing for another 3 hours and Id seen everything else, so I went and saw this.It has a really good story line. The main character is a criminal, and normally you think of criminals of just overall bad people. But you see that despite being a thief, or what society would call a bad person"" he still has compassion", empathy, and general human decency.Some of it was a little unrealistic. Such as, if youre a burglar, youre not going to drive a bright orange Volkswagen from 30 years ago, because thats too obvious. Likewise, youre not going to leave someone bloodied and tied up in the back of a Maserati. Thats like a $300K car.I enjoy the ending, because its not a happy one. The problem gets resolved, but its not a happy ending at all. It makes you wonder if, while the main characterSean was acting out of good and compassion," if it was really worth it given all th""",,,,,
26,2,shawneofthedead,10,This movie will blow your mind and break your,"Over the past decade, Marvel has earned itself the benefit of the doubt. The studio has consistently delivered smart, funny, brave films that both embrace and transcend their comic-book origins. The 18 blockbuster movies produced since Iron Man first blasted off into the stratosphere in 2008 have not only reinvented superhero films as a genre - theyve helped to legitimise it. Indeed, Marvels two most recent films - Thor Ragnarok and Black Panther - have received the kind of accolades usually reserved for edgy arthouse flicks. And yet, its perfectly reasonable to be apprehensive about Avengers Infinity War. This is a blockbuster film thats been ten years in the making, its plot hinted at and scattered throughout 18 other movies. It features 30 or so characters, each with their own complex backstories and motivations. And all of them are coming together in a bid to stop a giant purple alien dude from destroying the universe. It sounds ridiculous, and feels impossible. But thats precisely",,,,,,,,,,,,,,,
27,2,garethvk,10,A Summer Film That IS Even Better Than The Hy,"Summer movies often hype themselves as spectacular events not to be missed and their ad campaigns use words like epic"""," ""spectacle"""," and ""smash"" as ways to build the hype to increase advanced box office sales.The summer 2018 film season kicks off in a big way with ""Avengers Infinity War"" and it is the rare summer film that exceeds is lofty expectations and delivers a crowning achievement for the Marvel Cinematic Universe.When Thanos Josh Brolin", embarks on a deadly campaign to find and possess the Infinity Stones, he leaves a path of death and destruction in his path. When his pursuit leading him to Earth, Bruce Banner Mark Ruffalo, and Doctor Strange Benedict Cumberbatch, who enlist a reluctant Tony Stark Robert Downey Jr.," to the cause just as the minions of Thanos arrive.With The Avengers fractured and scattered following the events of ""Captain America Civil War"" the teams find themselves dealing with the threat in various groups as fate steps in to divide many key members of the t""",,,,,,,
28,2,kjames-26542,10,Unlike anything ever done in the history of c,"This movie is the beginning of the culmination of Marvels masterfully woven cinematic universe. Beginning back in 2008 with iron man, we are finally seeing the results of all the movies have been pointing to; and it did not disappoint. Thanos is a complex villain, with deeper and more interesting desires than just world domination."" The dilemmas all the characters face in this movie both the heroes and the villains are truly thought provoking and leave you on the edge of your seat. No other set of movies has beeen so involved", so expanded," and encompassed so many story lines/characters and previous movies. The sheer amount of star power alone in this film is insane; and they do a masterful job of weaving all these unique and various characters into a common storyline.""",,,,,,,,,,,,,
29,2,kevintgeisler,9,Excellent Film,"I was amazed to see so many negative reviews; so many people are impossible to please. This movie was 2 1/2 hours long, but I could have sat there another 2 1/2 hours and not noticed. Thoroughly entertaining, and I love how the directors werent afraid to take chances. Ive read a lot of other user reviews that claim that theres no plot. Unless youre mentally handicapped or not paying attention because youre on your phone the entire movie, the plot is pretty clear, and decent in my opinion.",,,,,,,,,,,,,,,
30,2,blparker-31738,10,The amount of people that dont understand the,"All the reviews that say this movie has no plot are either trolls, idiots, or didnt are to take the time to watch previous marvel movies. Every single one of those ratings and reviews should be taken down and not added to the rating for Infinity War because of their fundamental lack of understanding. Its like coming in and watching the last 2 minutes of an hour long drama show and saying this episode sucks because it has no plot. Its utterly ridiculous!There have been 31 marvel movies leading up to this point. All 31 has have some plot that leads to infinity war. Infinity War IS the end game movie. There is nothing left to explain, nothing left to discuss, it is all-out fight for control of the most powerful items in existence, the infinity stones. There have been 31 movies to explain in someway the power of these stones and/or the heroes that come together to fight Thanos in this movie. Its like a long game of chess where Thanos finally makes his move, and its a huge one.So I beg of a",,,,,,,,,,,,,,,
31,2,mto10,10,Epic conclusion to Marvels first 10 years,"I absolutely loved this movie. It was intense, action-packed and emotional. Also delivering comedy when needed, but it was a relatively dark film. All of the actors delivered great performances and the characters continue to be fleshed out and be made human despite the fact that theyre superheroes. This is easily the best superhero movie ever made. Thanos is one of the best villains of the MCU, as well as one of the best of Cinematic history in general. Upon first viewing, I hated him, but found his character intriguing. Similar to Emperor Palpatine in the Original and Prequel trilogies of Star Wars. The more times I rewatch it though, I start to understand Thanos point of view more and more. The blurred lines with his motivations make the movie more compelling. Even driving some people to say that Thanos was right in all this. I wouldnt go that far, but I would say his character is misunderstood. Definitely a compelling villain in Thanos. The ending of the movie was insanely emotional",,,,,,,,,,,,,,,
32,2,milleniumlogan,6,Overrated and bloated,"This movie was an underwhelming, chaotic blend of several different movies. Im going to break down several of the different elements of the movie and why they either worked or really did not work. Ill start with the villainThanos, as a whole, is a pretty good villain. He is intimidating and the movie gave him a good script. The problem is that his powers are so freakin inconsistent. Guardians of the Galaxy already established just how powerful infinity stones are, but Infinity War seems to forget that. In the battle on Titan, Iron Man and about five others are able to hold Thanos down and nearly get his gauntlet off. At this point, Thanos has four infinity stones. Sorry, but there is no way they could restrain him at that point.  Infinity War also includes four other villains which the directors apparently felt had no need for an introduction. Collectively, they are called the Black Order or dark order and their names are never said so, Ill give them nicknames. There is Noseless the Te",,,,,,,,,,,,,,,
