ID,Movie_ID,User_Name,Rating,Title,Content,,,,,,,,,,,,,,,
33,2,BiiivAL,9,"Again a fight, but bigger","I went and looked, and I want to express my thoughts.I went to this film with very high expectations, with a sense of something. I went to him twice, the first time, myself, and the second with the family, and I was even surprised that my mother, sister and dad who do not understand this movie at all brought unreal pleasure and an ocean of emotions.Each frame, each scene does not let you get bored, from the Marvel logo, and to the stage after the credits. Favorite heroes once again experienced side by side and you feel it, you are completely absorbed in a hurricane of events and you are watching it in one breath. In comparison with the War of Infinity, even the Confrontation looks like an ordinary fight in the sandbox.Uuuu, and the villain, the best as for me the best in this kirovoveselennoy, he is not just a bot at once, without motivation, no, its just the opposite. I liked Thanos so much that you do not want to, and he began to impress me, in terms of his convictions I had it only ",,,,,,,,,,,,,,,
34,2,pjgs200,7,An objective review of Avengers Infinity War,"I dont mean to be negative here, but Avengers Infinity Wars 8.9 on IMDb is entirely undeserved. Marvel superfan or not, this movie has nothing on films like The Dark Night, La La Land, Pulp Fiction, or Inception, all films which it either outranks based on its 8.9 rating or comes close to. I get that there was an insane amount of hype around this film, and its awesome to see our favorite Marvel characters come together The Guardians of the Galaxy, Thor, Spiderman, Captain America, Black Panther, etc., but we shouldnt let our excitement over all of our favorite characters coming together cloud the fact that Avengers Infinity War"" is an overly long movie that relies on cheap", unbelievable deaths to generate excitement and that isnt particularly well written or edited. I commend the directors and writers on being able to successfully interweave so many stories, but the movie just felt too long. Its fight scene after fight scene," and while the performances are good and the script is prett""",,,,,,,,,,,,
35,2,oliverdimitri,10,THE BEST SUPERHERO MOVIE EVER!!,"Engrossing, Epic, Emotional. Those are the three Es that define this movie. The latest instalment of the Marvel Cinematic Universe franchise is at its very best, culminating ten years of marvel adventure and spectacle with the biggest and most boldest movie in the superhero genre. So lets start with Anthony and Joe Russo, the geniuses that made this beast of a movie. After announcing that they will be directing the next two Avengers movies, Marvel fans knew at once that this will be the darkest Avengers movie yet. Yes, it was very dark with more of a serious tone. More than Winter Soldier and Civil War previous marvel movies directed by the Russo Bothers combined but they also had what the other Avengers movies had as well, the humour and it was not at all tasteless. Nobody really cared if it was necessary or not because the humour worked along with the edgy parts of the movie. This is by far the Russo brothers best work among the Marvel movies completely raising the bar of superhero m",,,,,,,,,,,,,,,
36,2,eden-rabatsch,9,"Great popcorn film, surprises the series with","Well, Well, Well....I was so ready to tear this down - 19th MCU film, too many stars, bloated CGI, first of a two parter, and so on and so on...Yet, this is so much fun. Pure popcorn...now in the dictionary under popcorn film"" is just the poster for this film. Somehow", the Russo Brothers have juggled all the parts to give everyone some time in the sun. They are helped immensely by two things the premise is so pure Mcguffin that you just watch Thanos look for Infinity Stones which gives a primal momentum and that the films stars/characters are looking to move on - that means, actual stakes for once as people could really die and not just comic book dying either.The DC people must be kicking themselves. The lightness and comedic touches are brilliant. You are laughing out loud, comedy level, but at totally organic character humour. It means you are so entertained throughout its rather long running time.The other big surprise is Thanos himself. Normally," I hate CGI characters but somehow""",,,,,,,,,,
37,2,hawkins_saints_rock,10,Everything we couldve hoped for,"Oh. My. God. What an incredible film! Ive never done a review of a movie before, Ive only done TV shows. So bare with me, Im gonna discuss the major points and chuck in a theory or two. But to start off...Wow. This film could be the best Marvel movie ever! But I will give it a few days to digest and probably a second viewing before deciding on that. It absolutely lived up to the 10 year build up since Iron Man 1, how far weve come in a quick 10 years is remarkable. The Thanos character absolutely hit the mark. He was menacing, intimidating, vicious and so much more. Props to the actor who played him. Thanos plan succeeds for the time being and we get a whole lot of death"" because of it. In this movie there was death"," and ""death"". The former refers to characters such as Loki", Vision and Gamora. We saw these characters die and there bodies be left behind. For this movie not to lose credibility, these characters, in my opinion," must remain dead. Now ""death"" refers to what we saw at the e""",,,,,,,,,,
38,2,upashnafuentes,9,I need a Therapist,"This movie has made me feel things that I havent about a movie in a very long time. If you are anything like me you will definitely feel a sense of everything is gonna be alright"" because of the generous sprinkling of light humour that makes the situation feel less serious than it actually is. The emotional roller coaster that begins right at the beginning of the movie to the very end has you feeling more and more frustrated and on edge as it goes on. Dont get me wrong this movie is absolutely stunning and amazing and a cliffhanger at the end has you wanting more and more. Im definitely very excited to see how this storyline will carry out in the next Avengers movie.""",,,,,,,,,,,,,,,
39,2,kuaci89,10,ABOVE MY EXPECTATION.,"Just WOW , The Russo nailed it, hand down from me they did it again. Part by part is interesting to watch , some of scene make me shock some scene make me wanna punch people so bad. Thanos is the best villain Ive ever seen. He not just normal villain to kill bunch of people because he love but his motivation so clear why he wanna do that and most people know he is collecting all the infinity stones. One of the best part of it the team up Guardian & Avengers just amazing, full of humor cannot stop laughing watching their scene together. For 1st time my brain cannot process what going to happen in Avengers 4 really hype about it.Really worth watching it , if u non Marvel fans or superheroes fan this movie is worth to watch , really enjoy it . Of course every good movie always have some issue with it but just MINOR issue can close eye and let it go. Going to watch it again soon . Love from Malaysia.",,,,,,,,,,,,,,,
40,2,pranayjalvi,9,Infinity War deserved to be the best and gran,"The most anticipated movie of 2018 has now been released and my word, I have to say that Infinity War was brilliant on each scale, whether be its story, Visual Effects and the ensemble cast consisting all the Marvel characters. Every Marvel Fan needs to watch the movie as words cannot describe the magnificience of the movie.",,,,,,,,,,,,,,,
41,2,hotjanuary,7,Marvel needs to keep their characters true an,"Infinity War is a good super hero movie. But I thought Thor Ragnarok and Black Panther were better.Marvel has a problem with level and types of power of the super heroes in their movies.1 if a battle between the Hulk and Thor in Ragnarok nearly destroy an arena made for super powered combat Im pretty sure Hulk vs Thanos in a spaceship would last one punch.2 Star-lord is just a dude, he does not catch and hold Spider-man.3 If Tony Stark can have dozens of flying robot iron men helping to fight bad guys in Iron Man 3 why not have 100s of them to help in Waconda? Im sure War Machine would have access to activate them.4 If Scarlet Witch can pickup and drop 1000 ton alien attack blades near Wakonda why do 2 dudes in Scotland give her a hard time?5 Steve Rogers isnt invulnerable. When swarmed by alien soldiers with sharp claws and teeth hes apparently unharmed after Thors hammer clears the baddies away. They had time to rip Steve up but didnt?Dont take the easy way out when writing the story",,,,,,,,,,,,,,,
42,2,robert-85923,4,Too much and not enough at the same time,"Im probably going against the general reception for this film but for me this film was just too much and not enough at the same time. Marvel fans will probably disagree with me. There is a star studded cast and clearly a lot of money has been spent to make this film a real spectacular.However, for me there were too many obvious special effects, too many leading characters and far far far too much action. It just keeps coming at you relentlessly. At the same time theres not enough real story and characterisation, not enough time to take in whats going on and definitely not enough warmth or comedy which is the hallmark of many Marvel films Ive seen before. I just wanted it to end but it kept dragging on for yet another battle... When it finally did end I felt cheated of the time.",,,,,,,,,,,,,,,
43,2,idaustin,2,CGI drivel disguised as something epic,"In order to explain current mass appeal, I have to quote Senator Gracchus in Gladiator Rome is the mob. Conjure magic for them and theyll be distracted.""And thats what this is", conjured magic meant to distract the masses, and by gosh, thats what its done. No real plot. Overlapping storylines that go nowhere, computer animated trash, and thats the point. Give the masses what they want, come up with the formula, spend $350 to develop, and presto, $2b in receipts from the mob, who cant distinguish between art and trash. Wash, rinse," repeat.""",,,
44,2,Lursa,4,"Plot Holes, Jumbled Action Sequences, & A Big","SPOILER ALERT!!I am a Marvel Chick. I totally dig the whole Marvel Verse and wave my fangirl flag proudly. I was looking forward to this movie so much...then something happened. I went to see it today. I did not read any of the reviews before I went. I never do. I always view a film without input from folk that usually dont know what I like. So there I was, popcorn and coke in hand. Two rows back from the screen cause Im into total immersion, okay in my reclining seat. Ten minutes in and I know were in trouble. Its not the fact that two of my favorite characters didnt survive the opening credits. This is Infinity War, right? People are gonna die. Its just seemed so pointless. Loki dies but Thor survives? How is that fair? Hemdall dies saving Hulk of all people?? Not that Im hatin on Hulk...but come on, Hemdall! You have sworn an oath to the Thone of Asgard and you dont save EITHER of the princes? Really?? I know Hulk is refusing to come out after Thanos kicks his butt that no one ever ",,,,,,,,,,,,,,,
45,2,TheBigSick,2,A tedious and dependent film,"SPOILER The plot is simple that the supervillian succeeds, but Russo brothers waste too much time on piling up the superheroes. The film is just too long, and you keep looking at the watch to see when it will end. There are too many characters, and if you did not view the previous Marvel films, you would hardly get any sense of who they are. It is an OK film for Marvel fans, but chaos for a general audience.",,,,,,,,,,,,,,,
46,2,rowpotdroid,1,Please stop the Hype!,"Suffering hype fatigue, over a year of industry talk about this movie in pre release. It takes away from viewing the movie. In the end its just more of the same computer generated over the top smash and bash that appeals to 12 year olds or those that are stuck at that age. The first avengers was original. But now what Hollywood movie makers due best, take an original movie concept to cash in until death in franchising occurs. Sorry about raining on your Hollywood comic book Heroes block borer. But the only hero I can see is someone to say enough comic book sequels. Theyve become boring and predictable recycles. I spent more time thinking about how uncomfortable the theater seat was than being interested in the things blowing up in the movie. Seems Hollywood is addicted to CGI for making movies that shouldnt be made. If they keep going this way they could probably try selling a film of things just blowing up, no story, plot or actors acting just things blowing up.",,,,,,,,,,,,,,,
47,2,dinhphuccdt,1,"Sorry marvel fans, this is trash","Another avengers movie, another crappy one. It is extremely overrated, overhyped, disappointed. The middle of the movie is slow and no intensity at all. The final battles are just tasteless, emotionless. I dont know why people cry or sad for this kind of ending. It is just tasteless. Honestly if Ironman died by being stabbed by Thanos, that would be emotional, because he fought hard and would die a real hero. But he didnt die, and the ending scene, dozens of heroes die one by one, like a natural death, I dont even think that they died fighting, and its too fast to be emotional. Its obvious that they will be revived in the next movie, why would I cry?. I felt the ending scene was just trying to get some tears from audience and set up for second part, which will definitely steal tons of money from marvels fan again.LASTLY, the motivation of Thanos to acquire 6 stones is the dumbest thing I have ever heard, even worst than my politicians. How killing half population of the universe solve ",,,,,,,,,,,,,,,
48,2,holgerscholl,1,Utterly disappointed,"So, this was it, the culmination of a decade of Marvel movies preparing and leading up to this final showdown? Well, I could not be more disappointed.Here is whyYes, the film brings together many different story lines. But it does so in pretty predictable ways. A few mildly funny scenes when the heroes of different movies meet for the first time. But thats it. Thats about the only good thing I can say about the story.Yes, CGI and FX are top notch. But as the story is pretty simple in itself until the end, thats not saving the day.The story in deed is very lame and to a large extend either predictable or stupid. There are quite some inconsistencies such as humans breathing on Titan, Thor talking in space and such. Not the ingredients of a fantastic climax movie.A few examples Spoilers!!!Thanos kills almost all Asgardians, but Thor. Thor proves he can survive and even talk in outer space, survive the fire of a star. Wow, really? Lame.Thanos is so powerful, you wonder why he hasnt collect",,,,,,,,,,,,,,,
49,2,derriivve,10,Wow that was trash,Deserves like not even a 1 star. this movie was nothing but CGI filled with subpar performances and a very mad score/soundtrack. the movie is basically just an ad for avengers 4. and in this film deaths occur at the end but they dont mean anything since all of them will come back. what? this is absolute trash storytelling. you expect audience to be sad and then just bring the characters back the next film.,,,,,,,,,,,,,,,
50,3,rupert-ian,7,What do you expect?,"Ok, lets see. A movie based on an incredibly simple video game about monsters climbing buildings and eating people. Do people go in thinking its going to be Oscar material?I love Godzilla. I love Kong Skull Island, Pacific Rim, you get the picture.Its a giant monster movie with The Rock and Negan in it. And it is a barrel of fun.The humor is good, the effects are great, the story is interesting, the pace is fast, the characters are fun.If you can turn off your brain and just have a good time, youll love this.For people saying they hated it, I have to question their reasoning for spending money on a movie that is clearly laid out by the trailer and premise alone. If you didnt enjoy it, what on earth did you expect?????",,,,,,,,,,,,,,,
51,3,jackgdemoss,7,Accept the film for what it is,"A movie about an old arcade game starring the Rock? Count me in. I went in with my brain shut off, and got a couple chuckles and, for the most part, everything I expected.",,,,,,,,,,,,,,,
52,3,facebook-923-997082,6,Gloriously Terrible,"Every single cliche of an action/horror/adventure flick rolled up into one. The charisma of the two big guys Dwayne and George carry the entire movie. This movie is not going to change your life, but it will keep you mildly amused.",,,,,,,,,,,,,,,
53,3,claudio_carvalho,6,Brainless Entertainment,"Rampage"" is one of those brainless entertainments full of clichés", plot holes and corny and terrible storyline. But if you have nothing to do and wants to spend your leisure time having fun and eating popcorns," ""Rampage"" is recommended. The viewer will see the hot Malin Akerman"," will recall Negan and will laugh with a white King Kong replica destroying a monster not affected by four missiles on its head with a steel bar through its eye. My vote is six.Title Brazil ""Rampage Destruição Total"" ""Rampage Total Destruction""""",,,,,,,,,,,,
54,3,TheTopDawg,8,"Appreciate this film for what it is fun, mind","Appreciate this film for what it is fun, mindless, action-filled entertainment. No need to dissect, analyse or compare this. My only few complaints are that the writing was too loose and should have been edited down by 15-20 mins to keep the pace more elevated throughout. Also, not a fan of the Energyne CEO sister and brother characters - they were way too cheesy and annoying and cheapened the film. All other actors were cast and performed great, and Dwayne entertained as always. The SFX/VFX were also great. A fun and well deserved 8/10 from me",,,,,,,,,,,,,,,
55,3,Stig-12345,8,"Excellent, but do NOT watch the trailer!","A lot better than expected. And on IMAX 3D this was a winner.Recommended!I hate trailers, and tried to watch the trailer after I watched the movie.. well, it shows EVERYTHING! If you want to see the movie without knowing whats going to happen, do NOT see the trailer.Im not sure why the trailers are so long and so revealing.They ruin everything for me. And in cinemas I have to watch a whole bunch of them!",,,,,,,,,,,,,,,
56,3,Scottizzle,10,This is exactly what you think it is... And t,"Its a Rampage movie, Im not sure what else people are expecting walking into this movie. Its fun, filled with action and very little on working on guy/girl romance which I always thought deviated from the plot anyhow. Its full of action, adventure and very slight amount of problem solving and thats all you need from a movie like this.",,,,,,,,,,,,,,,
57,3,TheTruthDoor,10,Top Fuel Fun!,"Inspired by the classic Arcade and later various other systems game of the same name, the movie boasts a predictably simple premise and lets just say the characters are not too complex.. yeah. But this is OK! Nobody will see this movie for compelling characters and dramatic scenes. The cast is mostly just passable, with the exception of Johnsonwho always rocks! and Jeffrey Dean Morgan who turns in one hell of an entertaining government agent, and of course George the gorilla is also one cool dude. It is like a live action Saturday morning cartoon! Its fun, high octane action with some pretty sweet scenes and solid effects. If you want to see a popcorn flick then look no further, if you remember the games nostalgia might be included!",,,,,,,,,,,,,,,
58,3,axlem2000,9,"Fun, humor and epicness!","My first review on this so Ill try keep it awesome without causing any spoilers or anything along those lines. This is all in my opinionFirstly, this movie was epic! Brad Peyton delivers. The movie was filled with action, with insane sequences of destruction. George is hilarious, I couldnt stop laughing! The camera work was executed well, the directing was great, the dialogue I felt couldve been tweaked. Overall, if you like action and destruction films then youll love this movie as its filled with action, suspense, humor and Dwayne Johnson!",,,,,,,,,,,,,,,
59,3,hasanbolkiah-91427,5,"Popcorn flick but nothing else, not terrible ","I didnt wasnt expecting much going to see this movie but it wasnt the worst of 2018. In fact, It is what you expect it to be in terms of being. a popcorn flick. I have to say the special effects were indeed well done but the dialogue ended up being cheesy and just forced throughout the film. I did enjoy the last 20 or so minutes as it showed what most people were waiting for. Monsters destroying Chicago and each other. The movie is good in terms of being a popcorn flick but nothing else7/10",,,,,,,,,,,,,,,
60,3,Blitz_Kid,4,"Lame, Cliche and Predictable","Your typical giant monster destroys the world movie.The movie is filled with cliches, the characters are very poorly developed. I didnt care about a single one of them. The Plot is also pretty lousy and extremely predictable, especially the ending.One good thing I would say about this movie, is it is filled with lots of action and good effects.Other than that? It fails at everything else.",,,,,,,,,,,,,,,
61,3,mitchellbieds,9,Very Fun Film,"I can understand why this film is getting low ratings, because it can be very cliched and cheesy especially with the dialogue, but that doesnt take away how fun it was!! Its no doubt that its the action and special effects that really drive this film and there are some pretty intense action sequences, not just the RAMPAGE in the last 20 minutes, which was probably the most fun Ive had in a movie for a while. The chemistry between Dwayne and George is very good, although I feel it couldve had a more emotional element to it. In regards to the humor, some of it landed and some didnt. Overall, If you go into this film and turn your brain off and just enjoy what it is, I think youll have a lot of fun with it. The film understands that it is ridiculous and a bit far fetched but again, its really fun especially the last 20mins.Go and experience this, you wont regret it.",,,,,,,,,,,,,,,
62,3,siriusly1986,1,The Real Monsters are these Multi-Million Dol,"Great cast but its another mindless, heartless giant monster flick destroying the city and trampling everyone. I wonder why the latest Godzilla movie got a bad rap but glorified B-movies like this and Kong Skull Island gets applauded. The monsters are obvious cgi hiding behind dense action sequences, the evil corporate guys are stereotypes from other monster, sci-fi movies we have seen a thousand times before and the military OF COURSE are worthless fodder. Tiny humvees closing in on very fast gigantic animals firing their machineguns knowing previously how that worked out, Apache helicopters firing at close range at a giant wolfs face with his worthless cannon instead of using guided rockets from a distance, and soldiers go out of their way to be squished like bugs ala Kong Skull Island style. Its that kind of thing you would see a child playing in his sandbox and destroying his toys. I would have understood if it was a child that made this movie.",,,,,,,,,,,,,,,
63,3,cruise01,9,"Action packed, big, loud, and a lot of fun.","Rampage 4.5 out of 5 stars.Video game adaptations into films have been ongoing with a curse from missing a specific target audience. Resident Evils are not great films but have been entertaining with its action. The new Tomb Raider reboot was surprisingly good but could have been more. And there are other lacklusters like Prince of Persia, Doom, Silent Hill, ect. A movie about three giant monsters of a crocodile, gorilla, and a grey wolf causing a mass destruction in a city. Yes, that is what the arcade games are about and that is exactly what you can expect in this Rampage film. At least, it is one hell of a wild ride of fun. So dont expect any award winning script with great dialogue, a long developing story, or logic with characters choices in the movie. If you leave all the critical thinking out before watching the film, you will find the film to be what it is. And it does its job, which is entertaining and being a lot of fun. The plot follows after a science experiment gone wrong ",,,,,,,,,,,,,,,
64,3,Takethispunch,10,Mindless action filled fun entertainment film,Global icon Dwayne Johnson headlines the action adventure Rampage," directed by Brad Peyton. Johnson stars as primatologist Davis Okoye, a man who keeps people at a distance but shares an unshakable bond with George, the extraordinarily intelligent, incredibly rare albino silverback gorilla who has been in his care since he rescued the young orphan from poachers. But a rogue genetic experiment gone awry mutates this gentle ape into a raging creature of enormous size.",,,,,,,,,,,,,,
65,3,donkeykong-66104,10,Best video game movie to date.,"Not going to win any oscars but what do you expect from this type of movie? It was all fun and I enjoyed it for what it was. I guess some people who didnt grow up in the gaming world and know or loved the rampage games might not get it"" but it was great fun.""",,,,,,,,,,,,,,,
66,3,danwatson_danwatson,9,I love it!,"If you loved the monster movie of old, this movie is for you. Great special effect, funny moments, and good old monster fighting/smashing!",,,,,,,,,,,,,,,
67,3,inkthestreetac,10,Entertaining,"The cgi in this movie was done so good. Every hair, dust particle, even eye movement was exceptional. The cast was amazing, they all seemed to be fully dedicated to this film. The best part is that they dont really curse, they do flip the bird. But overall if you liked the game and want to see a movie about a video game thats well done see this movie.",,,,,,,,,,,,,,,
