ID,Movie_ID,User_Name,Rating,Title,Content,,,,,,,,,,,,,,,
68,3,Figgy66-915-598470,10,Corny but I loved it,"16 April 2018Second fIlm of Choice at The Plaza Dorchester Tonight - Rampage. When man interferes with nature, it always goes wrong, you think people would learn but why do they have to when Dwayne Johnson is there to save the day!!! Inspired by a video game Im not familiar with, Rampage is as corny as they come, yet with monsters as gargantuan to the species as Dwayne Johnson is to his, this film somehow works. A science experiment, in the eyes of many, has gone wrong, but in the greedy money grabbing eyes of the people who are in control of the scientists, everything is right on track to make their fortune. Throw the military into the mix and you have a typical Hollywood all action disaster film. Once again Chicago bears the brunt, and its such visual feast of varying shaped buildings, interspersed with bridges, waterways, a raised railway transit system and a huge lake next to it, it must be a movie makers delight to base it as the battlefield of all manner of horror/disaster/saving",,,,,,,,,,,,,,,
69,3,gabrielmorenocorredor,10,A very entertaining movie,"Rampage is based on a video game which i didnt know until i search it up after seeing the trailer for the first time that got me interested. so far after see this movie yes it looks like a video game, but at least it has a story that makes sense the acting in this movie is great ,and even the effects. This movie is a entertaining movie for those who like action or even some time off.I give this movie a 10 for being everything I asked for it is like a GodzillaJapanese movies destruction movie which keeps kids wanting more destruction, so yes its a good movie to see. lets hope this is a new era of video game movies.",,,,,,,,,,,,,,,
70,3,casmowill,10,Funny and entertaining,I enjoyed the action packed unexpected scenes. It was also funny! I wasnt sure Id enjoy it but I thouroghly did.,,,,,,,,,,,,,,,
71,3,kyairaburnett,1,Trash... and everyones blind to it,"All in all, lets all agree that Dwayne makes the same exact movie over and over again. Handsome and oblivious"" all the time. No idea how he kept surviving and the sidekick lady was thrown into the plot. I couldnt care less what happened to her. But it make no sense how she survived either. I wouldve liked just Rampage fighting because every SINGLE WEAPON was conviently placed for Dwayne to use. It was insane. Never did they also realize how many people were dying. I didnt even understand the villains. What was their point. Neither did I understand the officer who wanted a hamster. It was a messy script. People need to realize that Dwayne doesnt make a movie better. He keeps repeating them. Eventually people will see it and stop type casting him until he comes onto set for an iconic movie and ruins it like Channon Tatum playing Gambit.""",,,,,,,,,,,,,,,
72,3,GOWBTW,9,"I played the game, but this is more fun!","I remembered playing the arcade game, Rampage"". You got the 3 animal characters George the Gorilla", Ralph the Wolf, and Lizzie the Lizard. In the new 2018 action film, George is an albino gorilla. Ralph is a flying wolf, and Lizzie is a mutated alligator. Dwayne Johnson plays Davis, a primatologist who takes care of George. He communicates with George through sign-language. When a genetic chemical made in a space lab crash lands, George, Ralph,and Lizzie come in contact with it, and the people responsible are located in Chicago, Illinois. George is from San Diego, Ralph, the Midwest, and Lizzie is from Florida from the Gulf Coast area. I know that they got George right," except for the albinoism. And how did Ralph and Lizzie ended up being mutants? Ralphs flying? And Lizzie is a freak of nature. Thats a little too much there. This movie has a bit of humor. George being very suggestive with his sign language. The action was non-stop. I enjoyed it very well. The plot was different from t""",
73,3,pchin230371,9,One Big Fun Roller Coaster....Strap your seat,"I walked it with zero expectation. I left my brain at the cinema entrance. This movie aint a cup of tea for everyone. I have lots of complaints but this time I will look at the bright side, oh boy I had fun and thrill watching this movie! As expected Dwayne Johnson saves the day again with his heroic acts plus some muscles obviously! He does rock indeed...badass.  Its good to see Jeffrey Dean Morgan here..I like this guy...oh man, in this movie this is literally the same man taken from the AMC Walking Dead TV series Negan"" except he is now in a suit and without his beloved Lucille! Its hilarious", this alone worth the ticket price! My only gripe is Jake Lacy Brett Wyden who looks like a halfwit. His sister is cool though.Well, this movie is one big mess Action, Monster, Terror, Destruction," etc...its like DNA of King Kong + Jurassic Park + Godzilla mixed together = A big fun roller coaster ride....plus some lewd jokes if you dont mind.For those of you who dont like Dwayne Johnson in th""",,,,,,,,,
74,3,seven-mod,10,Very entertaining,"If youre looking for a fun movie to watch, this is definitely it.",,,,,,,,,,,,,,,
75,4,treebeard-44735,6,The movie does not deserve the low reviews,"The movie did not receive the bad amount of comments or opinions it got from other users. Quite frankly, they are wrong in calling Truth or Dare a bad movie, as it is not meant to be a masterpiece but a fun movie to watch in a rainy day scenario. If you are looking for a movie that you can switch off to and just watch a movie that is mindless entertainment then Truth or Dare is a movie i recommend it if you can look past of the cliche horror tropes. Overall the movie as some decent young actors in it and is a passable horror movie so i suggest giving Truth or Dare a chance.",,,,,,,,,,,,,,,
76,4,jwwalrath-227-85487,7,People are too hard on this,"Im seeing a lot of bad reviews on this, and I think people are being way too critical. Dont get me wrong, this isnt the next A Quiet Place"" or ""It."" This is a PG-13 teen horror flick that shows a lot of sexy young adults being killed. Its goal is just to provide mindless", violent entertainment for a couple hours," and it serves its purpose well.Ive heard someone compare this to ""Final Destination"" and thats a pretty apt comparison. The driven force of this movie is some creative kills. The movie also keeps you guessing as to who meets the chopping block. Im also a found of the weirdly distinctive smile effect the monster uses when it possesses people.Ive heard complaints about the script and characters", but I dont see that. I mean theres nothing here to write home to mom about, but I found the script, characters," and acting to be solid.""",,,,,,,,,
77,4,davkell,6,Not as bad as people are saying it is!,"I really was keen on this when I originally saw the trailer, and then had my doubts when the first reviews came in. But it isnt as bad as many are saying it is. Yes, I probably wont ever watch it again, but it certainly kept me interested throughout the entire time. No spoilers, but the ending is certainly worth the watch. It created a bit of discussion on moral dilemmas between me and my 2 sons 16 & 14.",,,,,,,,,,,,,,,
78,4,asfurd,7,Lets Be Real Here,"People who rate this movie anything lower than 5 are obviously not taking their review seriously. They might not like the film personally, but that shouldnt generate a biased low score. Unlike a lot of other horror movies, this one actually had a backstory as to the origins and reasoning for the gameI was surprised with that. I expected it to just be a scary game with no purpose, but I genuinely respect that they added a backstory. Next, this movie is overall just unique and cool. Unlike other cliche horror films where some demon figure is haunting"" the house"," this film takes a unique approach by having a group of friends end up being the ones that have to do the ""haunting"" and ""killing""; this concept also played well on friendship and family bonds/truth telling and trusting one another. Lastly"," the creepy smiles make for iconic visuals that will stick with you even after you finish watching.""",,,,,,,,,,,,,
79,4,Jared_Andrews,2,So Terrible that its occassionally Funny and ,"You know how some movies can be so bad that theyre secretly kind of good? Truth or Dare might be one of those movies.  As far as being legitimately good, its not. Its terrible. Its littered with nonsensical reactions, silly dialogue, and unintentionally hilarious moments. Maybe those weird smiles that every character makes at one point are scary to others, but I found them funny every time.  The movie is pretty straightforward, but Ill give a brief explanation anyway. A group of friends goes to Mexico on spring break. While there, a stranger invites them to play truth or dare in a creepy abandoned church. It turns out that the game is possessed by a demon who follows them and forces them to continue playing the game until every player is dead. Fail a dare, you die. Tell a lie, you die. Refuse to play, you die.  The game and movie are essentially Jumanji crossed with Final Destination. Its PG-13, so its not nearly as graphic as Final Destination, which I didnt mind. It all sounds simple",,,,,,,,,,,,,,,
80,4,claudio_carvalho,3,Unoriginal and Laughable Storyline,"I believe any mediocre writer can buy unoriginal and laughable storylines like Truth or Dare"" with dots to be filled in accordance with the wished situation and maybe a list of films to be seen with the same storyline to give inspiration to the aspirant writer.A group of __ friends go to ___ and they bring a curse ______ with them. Along the story", ___ will die while the survivors try to find a way to break the curse. Question will they succeed? Y or No. In case of no," there will be an annex with cliffhangers for the sequel. The End.The storyline of ""Truth or Dare"" is exactly the same as described above", filling the dots with 6 - Mexico - of Truth and Dare - 3 - No.Based on the IMDb reviews, some people seem to have liked maybe parents, relatives," friends etc. or are paid to promote the annoying story. Check with your friends first before wasting your leisure time and money watching this garbage. My vote is three.Title Brazil ""Verdade ou Desafio"" ""Truth or Dare""""",,,,,,,,,
81,4,kdero34,3,Mega mind has the same smile,"Seriously, I finished the movie, closed out of in and went to my amazon title menue and there was a pic. of Mega Mind the movie and he has the SAME smile!!! LOL. In all seriousness there were MAGOR plot holes that could have made it so that EVERYONE who was alive could have won... I found the movie to be in decent concept but very immature. To top it off the ending made no sense. Why didnt they make it so EITHER of these 2 could happen 1 the demon picks truth and the girl asks the demon how do we kill you"" the demon would then HAVE to answer it truthfully otherwise it will die. Or 2 the demon picks truth", since the girl asked the demon to play it HAS to play right? So the girl picks truth, then asks the demon, the demon now HAS to pick dare," then girl says ""I dare you to KILL yourself demon and end the game"" demon now HAS to kill itsel. There"," see? Problem solved!!!""",,,,,,,,,,
82,4,prayoften,8,One of the BEST ENDINGS EVER,"After reading all of the negative reviews, I went into this movie fully expecting it to be a dud. But Regal is offering extra benefits for seeing 4 Universal movies this year this is one of the 4, so I said what the heck. Wow, was I pleasantly surprised. I really ended up getting into this movie. Its so different, very unique, filled with creative ideas, and entertaining throughout. The movie held my attention and it flew by. But the ending is where this movie will be remembered the most. It is without a doubt one of the most CLEVER ENDINGs Ive ever seen. The ending alone is worth going to see this movie. I have a strong feeling that too many people went into this movie with a negative bias, thus the reason for all of the negative reviews. It is also clear that most people clearly missed the entire premise of the ending, otherwise there would be more people on here raving about the brilliant ending to this movie. I certainly didnt see it coming. If you are one of the few who actually u",,,,,,,,,,,,,,,
83,4,channy_0130,6,What you expect,"If you have seen the trailer, then the movie is exactly what you would expect it to be. Its extremely average and cliched. Not a bad watch if you wanna kill some time, but I wouldnt waste your money on seeing it in the cinema.",,,,,,,,,,,,,,,
84,4,sashachambers-03252,8,These other reviews suck.. the movie was... r,"First off it was a scary movie, cheaply made or appeared to be but... with that said I found it entertaining. I watched it for what it was, a scary movie. I didnt jump out of my seat. But was surprised 2 times and that was good enough for me. Although the ending was obvious... the characters did a great job, there was a plot, there was a storyline. I enjoyed it. Was it my favorite NO, but it was by far better then Medeas Boo Halloween. No comparison. I will say this, to all the movie goers... these days, when they say turn off your damn cell phones, DO IT, Stop talking through the God Damn movies and for goodness sake, if a patron is sitting in a seat in front of you keep your damn feet off of the back of the seats.. This poor girl got told last night that her feet were awful smelling and I would appreciate it if she would move them. 12.50 to see a movie is allot, I hate when other inconsiderate patrons crap on it!",,,,,,,,,,,,,,,
85,4,Sci-FiHorrorFan,7,Im Sorry but this movie was Not Bad it was ac,"Yes, I liked the Film even though most people dont, The Film was actually surprisingly Tense and Thrilling And I like the fact that it took the possession concept and did something different with it so it wasnt your typical possession movie that we see a lot.The movie may start off as a cliche because of the truth or dare games the characters play but the movie later takes a different turn and it becomes a possession movie but done in a unique and interesting way that Ive never seen before.Thats part of the reason I liked the film because it uses the game of truth or dare and mixes it with possession among other things which made it more interesting and I think the movie deserves some credit for that.I didnt love the movie but I did Like the movie and it deserves a higher score on IMDB in my opinion.Im not saying the movie is Great but it was Good and it was pretty entertaining and intense most of the time.The characters may not be that good I can admit that but I didnt think they were",,,,,,,,,,,,,,,
86,4,neener3707,3,I Expected Bad - And I Got Bad,"One cannot deny the direction mainstream Hollywood horror"" films are going in", not a direction of true horror, but one of teen screams and cheap scares. And even though PG-13 Hollywood horror has created some gems like The Conjuring, for the most part they have disappointed this horror veteran. This film was no different, it just plain old wasnt scary, or thrilling, or suspenseful. To be fair I liked some the kills but other than that I could not find anything redeeming. Its another sad attempt by Hollywood at horror, it just isnt scary. Like many other mainstream horror films, I found myself being bored, waiting for the next scare/kill, only to be disappointed by it. But I suppose if you are a 14 year old girl, like the majority of the theater was, then I suppose it might scare you, but for a man who has been a horror nerd since childhood, this just didnt do it at all for me," I was truly disappointed.The acting was just so generic it ruined many aspects of the film. Not only did I no"""
87,4,mawhinney,6,Mediocre,"Ive seen better, Ive seen worse. This will be forgotten in a few weeks.I just didnt care about any of the characters. I typically enjoy BlumHouse horror films but this just felt lazy.",,,,,,,,,,,,,,,
88,4,jameszxcvbn,2,probably the worst horror flick in 2018 and i,"I went to watch this film because the trailer looked promising but what I got was a very ordinary and stupid plot of a film.The opening started promising yes with an interesting topic of players choosing truth or dare and if they dont do the mission, they die. Interesting plot with interesting build up of character thats showing the douchiness of the friends and a cheater and friends who are dumb enough to cover for that mess.Why I thought this film was crap was when that blonde chick was revealed to have slept with multiple guys. Okay, fair enough shes a slut but the fact that the main character was covering for that and that blonde friend got mad for revealing the truth. The build up of character is all a mess and where their priority lies is just all over the place. The fact that the blonde chick gets mad when she was the one doing all the cheating and the boyfriend Lucas not even getting 1 single bit mad at this fact. Literally the ONLY sad truth or dare part was when that Asian ch",,,,,,,,,,,,,,,
89,4,justinwfirestone,4,No joy in this curse,"It is, ahem, Blumhouses Truth or Dare, not just any-old, plain-old Truth or Dare. Its not the sixth installment of the cult classic Truth or Dare?  A Critical Madness, even though it psychologically draws from the same wells. Its not anything to do with Madonna Truth or Dare. It is its own self, although sex still kills, college kids love to drink a lot on Spring Break, and if theres a really mysterious curse that seems unstoppable, you can always find some kind of answers through clever Google queries, preferably using Apple products whenever possible.Be a good friend and dont be a jerk, or else you are going to get far less screen time than your cohorts, and definitely no nooky. The game of Truth or Dare? is no fun when the truth hurts and the dares maim. In fact, thats the biggest problem with Blumhouses Truth or Dare its not fun. Unlike Happy Death Day or The Strangers Prey at Night, theres almost no self-awareness that this is a pretty bad idea for a movie, no joy in an insipid pl",,,,,,,,,,,,,,,
90,4,martitah_1,2,I dare you NOT to stop laughing,"When I walked into the cinema, I was already certain that it was going to be bad based on the ratings here on IMDB. What I wasnt expecting was it to be so bad that it was more of a comedy than an actual horror movie. The whole room was laughing at the death scenes"" and strange facial distortions on the characters...When you see what looks like a Snapchat filter on the characters faces"," you start wondering if the budget was so low that they didnt have better ""special effects"" to make it more realistic and not so ridiculous. The plot is bad", the acting is bad, predictable jumpscares... You can pretty much tell the exact moment when you are supposed to get scared only you dont. All in all, avoid this movie at all costs. Unless, of course," you are like me and you are too bored and theres nothing else at the theater that you havent watched yet. The only reason I didnt give this a 1 is because I actually had a bit of fun while laughing at how bad it was. When you think that the ""pool vacuum""",,,,,,,,,
91,4,vacantskies00,5,Final Destination meets Ouija,"A group of teens find a supernatural entity that is using a game to kill them off one by one; unless you play by the rules. Director Jeff Wadlow is no stranger to the genre. The underrated meta-slasher Cry Wolf was a simple, yet intelligent take on PG-13 horror/thrillers. With Truth Or Dare, and Blumhouse in tow, he attempts to capture similar teenage themes of trust, denial, and the fact that your closet friend could be a liar. What works for this film is its ever evolving sense of menace. The entity really bares down on each characters flaws. Each kill"" has relevant motivation and pushes the rating to the max. The facial effects are decent and creepy. What works against the film are the characters. Most of them are disposable. Merely there to add death scenes and nothing more. Additionally", several scenes which couldve added more to certain character arcs simply cut away to move the story along," but leave possible dramatic elements to rot to get to the ""horror."" The most notable neg""",,,,,,,,,,,,,
92,4,cjlove2523,2,Dont waste your time,"Paint your house and watch the paint dry for more entertainment and scare yourself in the mirror if you want to be scared. This movie is sick, corny, and just plain stupid. Save your brain cells.",,,,,,,,,,,,,,,
93,4,matt_hall-18443,3,More of a Comedy than a Horror,"The film lacks so many qualities, when the trailer was first released I was dubious on what the final product would bring and was right to think like that. A production from Blumhouse for Horror gave me slight hope after a few creditable low end budget films in the past such as Get Out and Paranormal Activity. However, Blumhouse have released the latest rock bottom horror film that is one to forget as it contained minimal and predictable jump scares, a poor range of acting throughout however some possible potential from lead character Lucy Hale.If youre thinking about watching this film, dont spend the money in the cinema because its just not worth it and will probably be shown on TV or be on Netflix or Amazon Prime within the next year.",,,,,,,,,,,,,,,
94,4,michaelrthomson,1,Just Dont Do It,"Is a phrase someone should have said to those who proposed this premise, which of course has been done better 100 times already.Its inane teen fodder, poorly acted by low budget players, poorly written, poorly shot and fundamentally just poorly done.There are plenty of better horror movies out there to see, even if you fancy teen eye candy if that is what these teens were meant to be?.In an era where singers are auto-tuned but still deemed good by the youth of today, it is no surprise that this cast might be deemed good also, its just a pity no one has yet invented an auto-act machine, or an auto-writeascript machine.Certainly dont waste money seeing this trash in a cinema, I would guess this will be available online within a matter of days.",,,,,,,,,,,,,,,
95,4,Java_Joe,1,Stupid Concept Makes For a Stupid Movie.,"Hows this for an idea, you get a group of friends together and you play truth or dare. You know that game you played as kids, youd sit in a circle and say truth or dare"" to somebody and they had to pick one? Well this is what this movie is all about. But if you dont do the dare", or if you dont tell the truth you die. And you get a really stupid grin on your face before you do it because a demon or something invades your body and takes you over and kills you if you dont do it. Thats literally the movie. And yes," it is as stupid as it sounds. I expected so much more from Blumhouse but I guess they just werent that good a studio.""",,,,,,,,,,,,,
96,4,SmashandNasty,3,Youll never get the time you spent watching t,"There is no way to really articulate the exact place where this movie went wrong, other than to say that it did.It lacks the redeeming qualities of some of Blumhouses other outings it isnt as charming as Happy Death Day was; its not a socially aware as Get Out or the Purge franchise; it doesnt have unique techniques the original Paranormal Activity or Unfriended did. While most of those movies have things that are wrong with them as most movies do, they also had something that made them worth watching. After struggling to find its footing, Truth or Dare had little to nothing redeeming about it. What youre left with is a largely unsatisfying narrative with skewed and uncharacteristic character motivations culminating in a fairly predictable climax and then quickly falling from there to a conclusion that - while somewhat elver in its execution - made the film that much more frustrating.In short It feels a lot like any other teen slasher flick. They just put a different spin on things and",,,,,,,,,,,,,,,
97,4,stangpt-72073,7,Very interesting concept and story,Agree with the last review I read......Really Good....I do understand that horror or psychological entries reside in hades on movie review sites....Thats ok.... But I really thought this was a good movie worth watching.....The super low reviews are completely unsubstantiated.,,,,,,,,,,,,,,,
98,4,Sleepin_Dragon,7,Pretty good actually.,"Often I watch a horror, and find myself disappointed, reading the reviews I expected very little, but really enjoyed it. It lacks any true originality for me to score it higher then a 7, it feels very much influenced by the likes of Final Destination, bit all in all its very watchable. I liked the concept of a demon infiltrating a game, that was clever, and the faces of the victims when taken over were menacing, so it did have a degree of originality. The acting was great, production values were spot on, I find the negative reviews a bit unfair, and just plain wrong.Not bad at all. 7/10",,,,,,,,,,,,,,,
99,4,twmichael,1,News,I got crippling depression from the quality of this film. That is all.,,,,,,,,,,,,,,,
100,5,NarniaIsAwesome,7,Incredibles 2 is... Exciting and Acceptable.,"Incredibles 2"" was probably the most anticipated movie of the year; its hard to believe its made 14 years since the first original. So obviously everyone was more than ready for this.The film does come through when it comes to entertaining action and comedy", with Jack-Jack, Bob, and Edna providing most of the biggest laughs. The plot is interesting, because weve got to know what happened to the Parr family. As far as the supervillain mystery, its acceptable and somewhat entertaining, but a bit predictable and generic. The final criticism I have is that Edna definitely deserved more screen time.That being said," it is still an entertaining movie and not at all ""painful"" to watch.In conclusion"," ""Incredibles 2"" is funny", exciting," and really worth a viewing.""",,,,,
